[
  {
    "raceName": "formula 1 pre-season track session 2022",
    "circuitName": "circuit de barcelona-catalunya",
    "times": [
      {
        "gmtDiff": "+01:00",
        "startTime": "2022-02-25T09:00:00",
        "endTime": "2022-02-25T18:00:00",
        "BRLStartTime": "25/02/2022 09:00",
        "BRLEndTime": "25/02/2022 18:00"
      },
      {
        "gmtDiff": "+01:00",
        "startTime": "2022-02-24T09:00:00",
        "endTime": "2022-02-24T18:00:00",
        "BRLStartTime": "24/02/2022 09:00",
        "BRLEndTime": "24/02/2022 18:00"
      },
      {
        "gmtDiff": "+01:00",
        "startTime": "2022-02-23T09:00:00",
        "endTime": "2022-02-23T18:00:00",
        "BRLStartTime": "23/02/2022 09:00",
        "BRLEndTime": "23/02/2022 18:00"
      }
    ]
  },
  {
    "raceName": "formula 1 aramco pre-season testing 2022",
    "circuitName": "bahrain international circuit",
    "times": [
      {
        "gmtDiff": "+03:00",
        "startTime": "2022-03-12T10:00:00",
        "endTime": "2022-03-12T19:00:00",
        "BRLStartTime": "12/03/2022 10:00",
        "BRLEndTime": "12/03/2022 19:00"
      },
      {
        "gmtDiff": "+03:00",
        "startTime": "2022-03-11T10:00:00",
        "endTime": "2022-03-11T19:00:00",
        "BRLStartTime": "11/03/2022 10:00",
        "BRLEndTime": "11/03/2022 19:00"
      },
      {
        "gmtDiff": "+03:00",
        "startTime": "2022-03-10T10:00:00",
        "endTime": "2022-03-10T19:00:00",
        "BRLStartTime": "10/03/2022 10:00",
        "BRLEndTime": "10/03/2022 19:00"
      }
    ]
  },
  {
    "raceName": "formula 1 gulf air bahrain grand prix 2022",
    "circuitName": "bahrain international circuit",
    "times": [
      {
        "gmtDiff": "+03:00",
        "startTime": "2022-03-20T18:00:00",
        "endTime": "2022-03-20T20:00:00",
        "BRLStartTime": "20/03/2022 18:00",
        "BRLEndTime": "20/03/2022 20:00"
      },
      {
        "gmtDiff": "+03:00",
        "startTime": "2022-03-19T18:00:00",
        "endTime": "2022-03-19T19:00:00",
        "BRLStartTime": "19/03/2022 18:00",
        "BRLEndTime": "19/03/2022 19:00"
      },
      {
        "gmtDiff": "+03:00",
        "startTime": "2022-03-19T15:00:00",
        "endTime": "2022-03-19T16:00:00",
        "BRLStartTime": "19/03/2022 15:00",
        "BRLEndTime": "19/03/2022 16:00"
      },
      {
        "gmtDiff": "+03:00",
        "startTime": "2022-03-18T18:00:00",
        "endTime": "2022-03-18T19:00:00",
        "BRLStartTime": "18/03/2022 18:00",
        "BRLEndTime": "18/03/2022 19:00"
      },
      {
        "gmtDiff": "+03:00",
        "startTime": "2022-03-18T15:00:00",
        "endTime": "2022-03-18T16:00:00",
        "BRLStartTime": "18/03/2022 15:00",
        "BRLEndTime": "18/03/2022 16:00"
      }
    ]
  },
  {
    "raceName": "formula 1 stc saudi arabian grand prix 2022",
    "circuitName": "jeddah corniche circuit",
    "times": [
      {
        "gmtDiff": "+03:00",
        "startTime": "2022-03-27T20:00:00",
        "endTime": "2022-03-27T22:00:00",
        "BRLStartTime": "27/03/2022 20:00",
        "BRLEndTime": "27/03/2022 22:00"
      },
      {
        "gmtDiff": "+03:00",
        "startTime": "2022-03-26T20:00:00",
        "endTime": "2022-03-26T21:00:00",
        "BRLStartTime": "26/03/2022 20:00",
        "BRLEndTime": "26/03/2022 21:00"
      },
      {
        "gmtDiff": "+03:00",
        "startTime": "2022-03-26T17:00:00",
        "endTime": "2022-03-26T18:00:00",
        "BRLStartTime": "26/03/2022 17:00",
        "BRLEndTime": "26/03/2022 18:00"
      },
      {
        "gmtDiff": "+03:00",
        "startTime": "2022-03-25T20:00:00",
        "endTime": "2022-03-25T21:00:00",
        "BRLStartTime": "25/03/2022 20:00",
        "BRLEndTime": "25/03/2022 21:00"
      },
      {
        "gmtDiff": "+03:00",
        "startTime": "2022-03-25T17:00:00",
        "endTime": "2022-03-25T18:00:00",
        "BRLStartTime": "25/03/2022 17:00",
        "BRLEndTime": "25/03/2022 18:00"
      }
    ]
  },
  {
    "raceName": "formula 1 heineken australian grand prix 2022",
    "circuitName": "melbourne grand prix circuit",
    "times": [
      {
        "gmtDiff": "+10:00",
        "startTime": "2022-04-10T15:00:00",
        "endTime": "2022-04-10T17:00:00",
        "BRLStartTime": "10/04/2022 15:00",
        "BRLEndTime": "10/04/2022 17:00"
      },
      {
        "gmtDiff": "+10:00",
        "startTime": "2022-04-09T16:00:00",
        "endTime": "2022-04-09T17:00:00",
        "BRLStartTime": "09/04/2022 16:00",
        "BRLEndTime": "09/04/2022 17:00"
      },
      {
        "gmtDiff": "+10:00",
        "startTime": "2022-04-09T13:00:00",
        "endTime": "2022-04-09T14:00:00",
        "BRLStartTime": "09/04/2022 13:00",
        "BRLEndTime": "09/04/2022 14:00"
      },
      {
        "gmtDiff": "+10:00",
        "startTime": "2022-04-08T16:00:00",
        "endTime": "2022-04-08T17:00:00",
        "BRLStartTime": "08/04/2022 16:00",
        "BRLEndTime": "08/04/2022 17:00"
      },
      {
        "gmtDiff": "+10:00",
        "startTime": "2022-04-08T13:00:00",
        "endTime": "2022-04-08T14:00:00",
        "BRLStartTime": "08/04/2022 13:00",
        "BRLEndTime": "08/04/2022 14:00"
      }
    ]
  },
  {
    "raceName": "formula 1 rolex gran premio del made in italy e dell'emilia-romagna 2022",
    "circuitName": "autodromo enzo e dino ferrari",
    "sprintRace": true,
    "times": [
      {
        "gmtDiff": "+02:00",
        "startTime": "2022-04-24T15:00:00",
        "endTime": "2022-04-24T17:00:00",
        "BRLStartTime": "24/04/2022 15:00",
        "BRLEndTime": "24/04/2022 17:00"
      },
      {
        "gmtDiff": "+02:00",
        "startTime": "TBC",
        "endTime": "TBC",
        "BRLStartTime": "Invalid Date",
        "BRLEndTime": "Invalid Date"
      },
      {
        "gmtDiff": "+02:00",
        "startTime": "TBC",
        "endTime": "TBC",
        "BRLStartTime": "Invalid Date",
        "BRLEndTime": "Invalid Date"
      },
      {
        "gmtDiff": "+02:00",
        "startTime": "TBC",
        "endTime": "TBC",
        "BRLStartTime": "Invalid Date",
        "BRLEndTime": "Invalid Date"
      },
      {
        "gmtDiff": "+02:00",
        "startTime": "TBC",
        "endTime": "TBC",
        "BRLStartTime": "Invalid Date",
        "BRLEndTime": "Invalid Date"
      }
    ]
  },
  {
    "raceName": "formula 1 crypto.com miami grand prix 2022",
    "circuitName": "miami international autodrome",
    "times": [
      {
        "gmtDiff": "-04:00",
        "startTime": "2022-05-08T15:30:00",
        "endTime": "2022-05-08T17:30:00",
        "BRLStartTime": "08/05/2022 15:30",
        "BRLEndTime": "08/05/2022 17:30"
      },
      {
        "gmtDiff": "-04:00",
        "startTime": "2022-05-07T16:00:00",
        "endTime": "2022-05-07T17:00:00",
        "BRLStartTime": "07/05/2022 16:00",
        "BRLEndTime": "07/05/2022 17:00"
      },
      {
        "gmtDiff": "-04:00",
        "startTime": "2022-05-07T13:00:00",
        "endTime": "2022-05-07T14:00:00",
        "BRLStartTime": "07/05/2022 13:00",
        "BRLEndTime": "07/05/2022 14:00"
      },
      {
        "gmtDiff": "-04:00",
        "startTime": "2022-05-06T17:30:00",
        "endTime": "2022-05-06T18:30:00",
        "BRLStartTime": "06/05/2022 17:30",
        "BRLEndTime": "06/05/2022 18:30"
      },
      {
        "gmtDiff": "-04:00",
        "startTime": "2022-05-06T14:30:00",
        "endTime": "2022-05-06T15:30:00",
        "BRLStartTime": "06/05/2022 14:30",
        "BRLEndTime": "06/05/2022 15:30"
      }
    ]
  },
  {
    "raceName": "formula 1 pirelli gran premio de españa 2022",
    "circuitName": "circuit de barcelona-catalunya",
    "times": [
      {
        "gmtDiff": "+02:00",
        "startTime": "2022-05-22T15:00:00",
        "endTime": "2022-05-22T17:00:00",
        "BRLStartTime": "22/05/2022 15:00",
        "BRLEndTime": "22/05/2022 17:00"
      },
      {
        "gmtDiff": "+02:00",
        "startTime": "2022-05-21T16:00:00",
        "endTime": "2022-05-21T17:00:00",
        "BRLStartTime": "21/05/2022 16:00",
        "BRLEndTime": "21/05/2022 17:00"
      },
      {
        "gmtDiff": "+02:00",
        "startTime": "2022-05-21T13:00:00",
        "endTime": "2022-05-21T14:00:00",
        "BRLStartTime": "21/05/2022 13:00",
        "BRLEndTime": "21/05/2022 14:00"
      },
      {
        "gmtDiff": "+02:00",
        "startTime": "2022-05-20T17:00:00",
        "endTime": "2022-05-20T18:00:00",
        "BRLStartTime": "20/05/2022 17:00",
        "BRLEndTime": "20/05/2022 18:00"
      },
      {
        "gmtDiff": "+02:00",
        "startTime": "2022-05-20T14:00:00",
        "endTime": "2022-05-20T15:00:00",
        "BRLStartTime": "20/05/2022 14:00",
        "BRLEndTime": "20/05/2022 15:00"
      }
    ]
  },
  {
    "raceName": "formula 1 grand prix de monaco 2022",
    "circuitName": "circuit de monaco",
    "times": [
      {
        "gmtDiff": "+02:00",
        "startTime": "2022-05-29T15:00:00",
        "endTime": "2022-05-29T17:00:00",
        "BRLStartTime": "29/05/2022 15:00",
        "BRLEndTime": "29/05/2022 17:00"
      },
      {
        "gmtDiff": "+02:00",
        "startTime": "2022-05-28T16:00:00",
        "endTime": "2022-05-28T17:00:00",
        "BRLStartTime": "28/05/2022 16:00",
        "BRLEndTime": "28/05/2022 17:00"
      },
      {
        "gmtDiff": "+02:00",
        "startTime": "2022-05-28T13:00:00",
        "endTime": "2022-05-28T14:00:00",
        "BRLStartTime": "28/05/2022 13:00",
        "BRLEndTime": "28/05/2022 14:00"
      },
      {
        "gmtDiff": "+02:00",
        "startTime": "2022-05-27T17:00:00",
        "endTime": "2022-05-27T18:00:00",
        "BRLStartTime": "27/05/2022 17:00",
        "BRLEndTime": "27/05/2022 18:00"
      },
      {
        "gmtDiff": "+02:00",
        "startTime": "2022-05-27T14:00:00",
        "endTime": "2022-05-27T15:00:00",
        "BRLStartTime": "27/05/2022 14:00",
        "BRLEndTime": "27/05/2022 15:00"
      }
    ]
  },
  {
    "raceName": "formula 1 azerbaijan grand prix 2022",
    "circuitName": "baku city circuit",
    "times": [
      {
        "gmtDiff": "+04:00",
        "startTime": "2022-06-12T15:00:00",
        "endTime": "2022-06-12T17:00:00",
        "BRLStartTime": "12/06/2022 15:00",
        "BRLEndTime": "12/06/2022 17:00"
      },
      {
        "gmtDiff": "+04:00",
        "startTime": "2022-06-11T18:00:00",
        "endTime": "2022-06-11T19:00:00",
        "BRLStartTime": "11/06/2022 18:00",
        "BRLEndTime": "11/06/2022 19:00"
      },
      {
        "gmtDiff": "+04:00",
        "startTime": "2022-06-11T15:00:00",
        "endTime": "2022-06-11T16:00:00",
        "BRLStartTime": "11/06/2022 15:00",
        "BRLEndTime": "11/06/2022 16:00"
      },
      {
        "gmtDiff": "+04:00",
        "startTime": "2022-06-10T18:00:00",
        "endTime": "2022-06-10T19:00:00",
        "BRLStartTime": "10/06/2022 18:00",
        "BRLEndTime": "10/06/2022 19:00"
      },
      {
        "gmtDiff": "+04:00",
        "startTime": "2022-06-10T15:00:00",
        "endTime": "2022-06-10T16:00:00",
        "BRLStartTime": "10/06/2022 15:00",
        "BRLEndTime": "10/06/2022 16:00"
      }
    ]
  },
  {
    "raceName": "formula 1 grand prix du canada 2022",
    "circuitName": "circuit gilles-villeneuve",
    "times": [
      {
        "gmtDiff": "-04:00",
        "startTime": "2022-06-19T14:00:00",
        "endTime": "2022-06-19T16:00:00",
        "BRLStartTime": "19/06/2022 14:00",
        "BRLEndTime": "19/06/2022 16:00"
      },
      {
        "gmtDiff": "-04:00",
        "startTime": "2022-06-18T16:00:00",
        "endTime": "2022-06-18T17:00:00",
        "BRLStartTime": "18/06/2022 16:00",
        "BRLEndTime": "18/06/2022 17:00"
      },
      {
        "gmtDiff": "-04:00",
        "startTime": "2022-06-18T13:00:00",
        "endTime": "2022-06-18T14:00:00",
        "BRLStartTime": "18/06/2022 13:00",
        "BRLEndTime": "18/06/2022 14:00"
      },
      {
        "gmtDiff": "-04:00",
        "startTime": "2022-06-17T17:00:00",
        "endTime": "2022-06-17T18:00:00",
        "BRLStartTime": "17/06/2022 17:00",
        "BRLEndTime": "17/06/2022 18:00"
      },
      {
        "gmtDiff": "-04:00",
        "startTime": "2022-06-17T14:00:00",
        "endTime": "2022-06-17T15:00:00",
        "BRLStartTime": "17/06/2022 14:00",
        "BRLEndTime": "17/06/2022 15:00"
      }
    ]
  },
  {
    "raceName": "formula 1 british grand prix 2022",
    "circuitName": "silverstone circuit",
    "times": [
      {
        "gmtDiff": "+01:00",
        "startTime": "2022-07-03T15:00:00",
        "endTime": "2022-07-03T17:00:00",
        "BRLStartTime": "03/07/2022 15:00",
        "BRLEndTime": "03/07/2022 17:00"
      },
      {
        "gmtDiff": "+01:00",
        "startTime": "2022-07-02T15:00:00",
        "endTime": "2022-07-02T16:00:00",
        "BRLStartTime": "02/07/2022 15:00",
        "BRLEndTime": "02/07/2022 16:00"
      },
      {
        "gmtDiff": "+01:00",
        "startTime": "2022-07-02T12:00:00",
        "endTime": "2022-07-02T13:00:00",
        "BRLStartTime": "02/07/2022 12:00",
        "BRLEndTime": "02/07/2022 13:00"
      },
      {
        "gmtDiff": "+01:00",
        "startTime": "2022-07-01T16:00:00",
        "endTime": "2022-07-01T17:00:00",
        "BRLStartTime": "01/07/2022 16:00",
        "BRLEndTime": "01/07/2022 17:00"
      },
      {
        "gmtDiff": "+01:00",
        "startTime": "2022-07-01T13:00:00",
        "endTime": "2022-07-01T14:00:00",
        "BRLStartTime": "01/07/2022 13:00",
        "BRLEndTime": "01/07/2022 14:00"
      }
    ]
  },
  {
    "raceName": "formula 1 grosser preis von österreich 2022",
    "sprintRace": true,
    "circuitName": "red bull ring",
    "times": [
      {
        "gmtDiff": "+02:00",
        "startTime": "2022-07-10T15:00:00",
        "endTime": "2022-07-10T17:00:00",
        "BRLStartTime": "10/07/2022 15:00",
        "BRLEndTime": "10/07/2022 17:00"
      },
      {
        "gmtDiff": "+02:00",
        "startTime": "TBC",
        "endTime": "TBC",
        "BRLStartTime": "Invalid Date",
        "BRLEndTime": "Invalid Date"
      },
      {
        "gmtDiff": "+02:00",
        "startTime": "TBC",
        "endTime": "TBC",
        "BRLStartTime": "Invalid Date",
        "BRLEndTime": "Invalid Date"
      },
      {
        "gmtDiff": "+02:00",
        "startTime": "TBC",
        "endTime": "TBC",
        "BRLStartTime": "Invalid Date",
        "BRLEndTime": "Invalid Date"
      },
      {
        "gmtDiff": "+02:00",
        "startTime": "TBC",
        "endTime": "TBC",
        "BRLStartTime": "Invalid Date",
        "BRLEndTime": "Invalid Date"
      }
    ]
  },
  {
    "raceName": "formula 1 grand prix de france 2022",
    "circuitName": "circuit paul ricard",
    "times": [
      {
        "gmtDiff": "+02:00",
        "startTime": "2022-07-24T15:00:00",
        "endTime": "2022-07-24T17:00:00",
        "BRLStartTime": "24/07/2022 15:00",
        "BRLEndTime": "24/07/2022 17:00"
      },
      {
        "gmtDiff": "+02:00",
        "startTime": "2022-07-23T16:00:00",
        "endTime": "2022-07-23T17:00:00",
        "BRLStartTime": "23/07/2022 16:00",
        "BRLEndTime": "23/07/2022 17:00"
      },
      {
        "gmtDiff": "+02:00",
        "startTime": "2022-07-23T13:00:00",
        "endTime": "2022-07-23T14:00:00",
        "BRLStartTime": "23/07/2022 13:00",
        "BRLEndTime": "23/07/2022 14:00"
      },
      {
        "gmtDiff": "+02:00",
        "startTime": "2022-07-22T17:00:00",
        "endTime": "2022-07-22T18:00:00",
        "BRLStartTime": "22/07/2022 17:00",
        "BRLEndTime": "22/07/2022 18:00"
      },
      {
        "gmtDiff": "+02:00",
        "startTime": "2022-07-22T14:00:00",
        "endTime": "2022-07-22T15:00:00",
        "BRLStartTime": "22/07/2022 14:00",
        "BRLEndTime": "22/07/2022 15:00"
      }
    ]
  },
  {
    "raceName": "formula 1 magyar nagydíj 2022",
    "circuitName": "hungaroring",
    "times": [
      {
        "gmtDiff": "+02:00",
        "startTime": "2022-07-31T15:00:00",
        "endTime": "2022-07-31T17:00:00",
        "BRLStartTime": "31/07/2022 15:00",
        "BRLEndTime": "31/07/2022 17:00"
      },
      {
        "gmtDiff": "+02:00",
        "startTime": "2022-07-30T16:00:00",
        "endTime": "2022-07-30T17:00:00",
        "BRLStartTime": "30/07/2022 16:00",
        "BRLEndTime": "30/07/2022 17:00"
      },
      {
        "gmtDiff": "+02:00",
        "startTime": "2022-07-30T13:00:00",
        "endTime": "2022-07-30T14:00:00",
        "BRLStartTime": "30/07/2022 13:00",
        "BRLEndTime": "30/07/2022 14:00"
      },
      {
        "gmtDiff": "+02:00",
        "startTime": "2022-07-29T17:00:00",
        "endTime": "2022-07-29T18:00:00",
        "BRLStartTime": "29/07/2022 17:00",
        "BRLEndTime": "29/07/2022 18:00"
      },
      {
        "gmtDiff": "+02:00",
        "startTime": "2022-07-29T14:00:00",
        "endTime": "2022-07-29T15:00:00",
        "BRLStartTime": "29/07/2022 14:00",
        "BRLEndTime": "29/07/2022 15:00"
      }
    ]
  },
  {
    "raceName": "formula 1 rolex belgian grand prix 2022",
    "circuitName": "circuit de spa-francorchamps",
    "times": [
      {
        "gmtDiff": "+02:00",
        "startTime": "2022-08-28T15:00:00",
        "endTime": "2022-08-28T17:00:00",
        "BRLStartTime": "28/08/2022 15:00",
        "BRLEndTime": "28/08/2022 17:00"
      },
      {
        "gmtDiff": "+02:00",
        "startTime": "2022-08-27T16:00:00",
        "endTime": "2022-08-27T17:00:00",
        "BRLStartTime": "27/08/2022 16:00",
        "BRLEndTime": "27/08/2022 17:00"
      },
      {
        "gmtDiff": "+02:00",
        "startTime": "2022-08-27T13:00:00",
        "endTime": "2022-08-27T14:00:00",
        "BRLStartTime": "27/08/2022 13:00",
        "BRLEndTime": "27/08/2022 14:00"
      },
      {
        "gmtDiff": "+02:00",
        "startTime": "2022-08-26T17:00:00",
        "endTime": "2022-08-26T18:00:00",
        "BRLStartTime": "26/08/2022 17:00",
        "BRLEndTime": "26/08/2022 18:00"
      },
      {
        "gmtDiff": "+02:00",
        "startTime": "2022-08-26T14:00:00",
        "endTime": "2022-08-26T15:00:00",
        "BRLStartTime": "26/08/2022 14:00",
        "BRLEndTime": "26/08/2022 15:00"
      }
    ]
  },
  {
    "raceName": "formula 1 heineken dutch grand prix 2022",
    "circuitName": "circuit zandvoort",
    "times": [
      {
        "gmtDiff": "+02:00",
        "startTime": "2022-09-04T15:00:00",
        "endTime": "2022-09-04T17:00:00",
        "BRLStartTime": "04/09/2022 15:00",
        "BRLEndTime": "04/09/2022 17:00"
      },
      {
        "gmtDiff": "+02:00",
        "startTime": "2022-09-03T16:00:00",
        "endTime": "2022-09-03T17:00:00",
        "BRLStartTime": "03/09/2022 16:00",
        "BRLEndTime": "03/09/2022 17:00"
      },
      {
        "gmtDiff": "+02:00",
        "startTime": "2022-09-03T13:00:00",
        "endTime": "2022-09-03T14:00:00",
        "BRLStartTime": "03/09/2022 13:00",
        "BRLEndTime": "03/09/2022 14:00"
      },
      {
        "gmtDiff": "+02:00",
        "startTime": "2022-09-02T17:00:00",
        "endTime": "2022-09-02T18:00:00",
        "BRLStartTime": "02/09/2022 17:00",
        "BRLEndTime": "02/09/2022 18:00"
      },
      {
        "gmtDiff": "+02:00",
        "startTime": "2022-09-02T14:00:00",
        "endTime": "2022-09-02T15:00:00",
        "BRLStartTime": "02/09/2022 14:00",
        "BRLEndTime": "02/09/2022 15:00"
      }
    ]
  },
  {
    "raceName": "formula 1 pirelli gran premio d’italia 2022",
    "circuitName": "autodromo nazionale monza",
    "times": [
      {
        "gmtDiff": "+02:00",
        "startTime": "2022-09-11T15:00:00",
        "endTime": "2022-09-11T17:00:00",
        "BRLStartTime": "11/09/2022 15:00",
        "BRLEndTime": "11/09/2022 17:00"
      },
      {
        "gmtDiff": "+02:00",
        "startTime": "2022-09-10T16:00:00",
        "endTime": "2022-09-10T17:00:00",
        "BRLStartTime": "10/09/2022 16:00",
        "BRLEndTime": "10/09/2022 17:00"
      },
      {
        "gmtDiff": "+02:00",
        "startTime": "2022-09-10T13:00:00",
        "endTime": "2022-09-10T14:00:00",
        "BRLStartTime": "10/09/2022 13:00",
        "BRLEndTime": "10/09/2022 14:00"
      },
      {
        "gmtDiff": "+02:00",
        "startTime": "2022-09-09T17:00:00",
        "endTime": "2022-09-09T18:00:00",
        "BRLStartTime": "09/09/2022 17:00",
        "BRLEndTime": "09/09/2022 18:00"
      },
      {
        "gmtDiff": "+02:00",
        "startTime": "2022-09-09T14:00:00",
        "endTime": "2022-09-09T15:00:00",
        "BRLStartTime": "09/09/2022 14:00",
        "BRLEndTime": "09/09/2022 15:00"
      }
    ]
  },
  {
    "raceName": "formula 1 singapore grand prix 2022",
    "circuitName": "marina bay street circuit",
    "times": [
      {
        "gmtDiff": "+08:00",
        "startTime": "2022-10-02T20:00:00",
        "endTime": "2022-10-02T22:00:00",
        "BRLStartTime": "02/10/2022 20:00",
        "BRLEndTime": "02/10/2022 22:00"
      },
      {
        "gmtDiff": "+08:00",
        "startTime": "2022-10-01T21:00:00",
        "endTime": "2022-10-01T22:00:00",
        "BRLStartTime": "01/10/2022 21:00",
        "BRLEndTime": "01/10/2022 22:00"
      },
      {
        "gmtDiff": "+08:00",
        "startTime": "2022-10-01T18:00:00",
        "endTime": "2022-10-01T19:00:00",
        "BRLStartTime": "01/10/2022 18:00",
        "BRLEndTime": "01/10/2022 19:00"
      },
      {
        "gmtDiff": "+08:00",
        "startTime": "2022-09-30T21:00:00",
        "endTime": "2022-09-30T22:00:00",
        "BRLStartTime": "30/09/2022 21:00",
        "BRLEndTime": "30/09/2022 22:00"
      },
      {
        "gmtDiff": "+08:00",
        "startTime": "2022-09-30T18:00:00",
        "endTime": "2022-09-30T19:00:00",
        "BRLStartTime": "30/09/2022 18:00",
        "BRLEndTime": "30/09/2022 19:00"
      }
    ]
  },
  {
    "raceName": "formula 1 japanese grand prix 2022",
    "circuitName": "suzuka international racing course",
    "times": [
      {
        "gmtDiff": "+09:00",
        "startTime": "2022-10-09T14:00:00",
        "endTime": "2022-10-09T16:00:00",
        "BRLStartTime": "09/10/2022 14:00",
        "BRLEndTime": "09/10/2022 16:00"
      },
      {
        "gmtDiff": "+09:00",
        "startTime": "2022-10-08T16:00:00",
        "endTime": "2022-10-08T17:00:00",
        "BRLStartTime": "08/10/2022 16:00",
        "BRLEndTime": "08/10/2022 17:00"
      },
      {
        "gmtDiff": "+09:00",
        "startTime": "2022-10-08T13:00:00",
        "endTime": "2022-10-08T14:00:00",
        "BRLStartTime": "08/10/2022 13:00",
        "BRLEndTime": "08/10/2022 14:00"
      },
      {
        "gmtDiff": "+09:00",
        "startTime": "2022-10-07T16:00:00",
        "endTime": "2022-10-07T17:00:00",
        "BRLStartTime": "07/10/2022 16:00",
        "BRLEndTime": "07/10/2022 17:00"
      },
      {
        "gmtDiff": "+09:00",
        "startTime": "2022-10-07T13:00:00",
        "endTime": "2022-10-07T14:00:00",
        "BRLStartTime": "07/10/2022 13:00",
        "BRLEndTime": "07/10/2022 14:00"
      }
    ]
  },
  {
    "raceName": "formula 1 aramco united states grand prix 2022",
    "circuitName": "circuit of the americas",
    "times": [
      {
        "gmtDiff": "-05:00",
        "startTime": "2022-10-23T14:00:00",
        "endTime": "2022-10-23T16:00:00",
        "BRLStartTime": "23/10/2022 14:00",
        "BRLEndTime": "23/10/2022 16:00"
      },
      {
        "gmtDiff": "-05:00",
        "startTime": "2022-10-22T17:00:00",
        "endTime": "2022-10-22T18:00:00",
        "BRLStartTime": "22/10/2022 17:00",
        "BRLEndTime": "22/10/2022 18:00"
      },
      {
        "gmtDiff": "-05:00",
        "startTime": "2022-10-22T14:00:00",
        "endTime": "2022-10-22T15:00:00",
        "BRLStartTime": "22/10/2022 14:00",
        "BRLEndTime": "22/10/2022 15:00"
      },
      {
        "gmtDiff": "-05:00",
        "startTime": "2022-10-21T17:00:00",
        "endTime": "2022-10-21T18:00:00",
        "BRLStartTime": "21/10/2022 17:00",
        "BRLEndTime": "21/10/2022 18:00"
      },
      {
        "gmtDiff": "-05:00",
        "startTime": "2022-10-21T14:00:00",
        "endTime": "2022-10-21T15:00:00",
        "BRLStartTime": "21/10/2022 14:00",
        "BRLEndTime": "21/10/2022 15:00"
      }
    ]
  },
  {
    "raceName": "formula 1 gran premio de la ciudad de méxico 2022",
    "circuitName": "autódromo hermanos rodríguez",
    "times": [
      {
        "gmtDiff": "-06:00",
        "startTime": "2022-10-30T14:00:00",
        "endTime": "2022-10-30T16:00:00",
        "BRLStartTime": "30/10/2022 14:00",
        "BRLEndTime": "30/10/2022 16:00"
      },
      {
        "gmtDiff": "-05:00",
        "startTime": "2022-10-29T15:00:00",
        "endTime": "2022-10-29T16:00:00",
        "BRLStartTime": "29/10/2022 15:00",
        "BRLEndTime": "29/10/2022 16:00"
      },
      {
        "gmtDiff": "-05:00",
        "startTime": "2022-10-29T12:00:00",
        "endTime": "2022-10-29T13:00:00",
        "BRLStartTime": "29/10/2022 12:00",
        "BRLEndTime": "29/10/2022 13:00"
      },
      {
        "gmtDiff": "-05:00",
        "startTime": "2022-10-28T16:00:00",
        "endTime": "2022-10-28T17:00:00",
        "BRLStartTime": "28/10/2022 16:00",
        "BRLEndTime": "28/10/2022 17:00"
      },
      {
        "gmtDiff": "-05:00",
        "startTime": "2022-10-28T13:00:00",
        "endTime": "2022-10-28T14:00:00",
        "BRLStartTime": "28/10/2022 13:00",
        "BRLEndTime": "28/10/2022 14:00"
      }
    ]
  },
  {
    "raceName": "formula 1 heineken grande prêmio de são paulo 2022",
    "circuitName": "autódromo josé carlos pace",
    "sprintRace": true,
    "times": [
      {
        "gmtDiff": "-03:00",
        "startTime": "2022-11-13T15:00:00",
        "endTime": "2022-11-13T17:00:00",
        "BRLStartTime": "13/11/2022 15:00",
        "BRLEndTime": "13/11/2022 17:00"
      },
      {
        "gmtDiff": "-03:00",
        "startTime": "TBC",
        "endTime": "TBC",
        "BRLStartTime": "Invalid Date",
        "BRLEndTime": "Invalid Date"
      },
      {
        "gmtDiff": "-03:00",
        "startTime": "TBC",
        "endTime": "TBC",
        "BRLStartTime": "Invalid Date",
        "BRLEndTime": "Invalid Date"
      },
      {
        "gmtDiff": "-03:00",
        "startTime": "TBC",
        "endTime": "2022-11-11T17:00:00",
        "BRLStartTime": "Invalid Date",
        "BRLEndTime": "11/11/2022 17:00"
      },
      {
        "gmtDiff": "-03:00",
        "startTime": "TBC",
        "endTime": "TBC",
        "BRLStartTime": "Invalid Date",
        "BRLEndTime": "Invalid Date"
      }
    ]
  },
  {
    "raceName": "formula 1 etihad airways abu dhabi grand prix 2022",
    "circuitName": "yas marina circuit",
    "times": [
      {
        "gmtDiff": "+04:00",
        "startTime": "2022-11-20T17:00:00",
        "endTime": "2022-11-20T19:00:00",
        "BRLStartTime": "20/11/2022 17:00",
        "BRLEndTime": "20/11/2022 19:00"
      },
      {
        "gmtDiff": "+04:00",
        "startTime": "2022-11-19T18:00:00",
        "endTime": "2022-11-19T19:00:00",
        "BRLStartTime": "19/11/2022 18:00",
        "BRLEndTime": "19/11/2022 19:00"
      },
      {
        "gmtDiff": "+04:00",
        "startTime": "2022-11-19T15:00:00",
        "endTime": "2022-11-19T16:00:00",
        "BRLStartTime": "19/11/2022 15:00",
        "BRLEndTime": "19/11/2022 16:00"
      },
      {
        "gmtDiff": "+04:00",
        "startTime": "2022-11-18T17:00:00",
        "endTime": "2022-11-18T18:00:00",
        "BRLStartTime": "18/11/2022 17:00",
        "BRLEndTime": "18/11/2022 18:00"
      },
      {
        "gmtDiff": "+04:00",
        "startTime": "2022-11-18T14:00:00",
        "endTime": "2022-11-18T15:00:00",
        "BRLStartTime": "18/11/2022 14:00",
        "BRLEndTime": "18/11/2022 15:00"
      }
    ]
  }
]